product,rating,price,img_url,brand,customer_say,gender,individual_review
Reebok Womens Nano X5,4.6,120.0,https://m.media-amazon.com/images/I/51gQSUq5S3L._AC_SY395_SX395_QL70_FMwebp_.jpg,Reebok,No summary available.,Women,"I’ve been using the Nano X5s for my HYROX training, and they’ve been amazing. I have been researching shoes that are not for running but for indoor/outdoor cross-fit training, which requires both lightweight and harder soles for weight training.The stability is incredible during sled pushes and wall balls, and they still feel light and responsive enough for running segments. I also love how snug and supportive they are without being too stiff. The grip is solid on all surfaces, and I haven’t had any issues with slipping, even during burpee broad jumps or farmer carries. If you’re doing functional fitness or hybrid races like HYROX, these are a great choice."
Reebok Womens Princess Signature Casual,4.4,36.0,https://m.media-amazon.com/images/I/61Io4vrf5rL._AC_SX395_SY395_QL70_FMwebp_.jpg,Reebok,"Customers find these sneakers comfortable, well-made, and appreciate their pastel pink color that's not neon. The shoes receive positive feedback for their value, with customers saying they're excellent for the money. Customers disagree on the fit, with some finding them true to size while others say they're too small. The cushioning receives mixed reviews, with some praising the soft leather that molds to the foot while others find them stiff. The material quality also draws criticism, with customers noting the faux leather quality is terrible.",Women,"The only problem I had was suggested size. It should have been a half size larger. I would have sent them back for a bigger size but I have epilepsy, can"
Reebok Womens RBK Premier Road Plus VI,4.3,50.0,https://m.media-amazon.com/images/I/61S0fAjZ+sL._AC_SY395_SX395_QL70_ML2_.jpg,Reebok,"Customers find these sneakers comfortable and stylish, particularly noting they're trendy for summer and fall. However, the cardio benefits receive mixed feedback, with some customers saying they're not suitable for cardio activities.",Women,So cute and super supportive. Wear these for walking and cardio and no pain!
Reebok Womens Rewind Run,4.6,41.0,https://m.media-amazon.com/images/I/615jkqxH-0L._AC_SX395_SY395_QL70_ML2_.jpg,Reebok,"Customers find these sneakers comfortable with lots of cushioning and appreciate their cute appearance, with one customer noting the iridiscent pink trim. The shoes receive positive feedback for their quality, being suitable for gym use, and customers consider them good value for money. Customers disagree on whether the shoes are true to size, and opinions vary on their durability and traction.",Women,Quite comfy and quiet pair of sneaks. Doesn’t make squeaky noises across hardwood floors. Fits pretty true to size as I’m a 8.5 foot but definitely more of a narrow width. So would suggest go up a 1/2 size if your foot is wide or has a high arch.
Reebok Womens Spark Run,4.0,40.0,https://m.media-amazon.com/images/I/61ZXgMd+SuL._AC_SX395_SY395_QL70_FMwebp_.jpg,Reebok,No summary available.,Women,Love them
Reebok Womens Walk Ultra 7 DMX Max,4.2,52.0,https://m.media-amazon.com/images/I/71wfISk++wL._AC_SY395_SX395_QL70_FMwebp_.jpg,Reebok,"Customers find these walking shoes comfortable, well-made, and appreciate their strong arch support for all-day standing. The shoes receive positive feedback for their appearance and value for money. However, customers disagree on the fit, with some finding them perfect while others say they're too small, and there are mixed experiences with foot pain. Additionally, several customers report that the shoes squeak significantly when walking.",Women,"I received these today and have been wearing them all afternoon. They are so comfortable! A lot of shoes just make my feet hurt, even expensive tennis shoes, so that"
Reebok Womens Work N Cushion Non Slip Work,3.8,61.0,https://m.media-amazon.com/images/I/71S52BYieGL._AC_SY395_SX395_QL70_FMwebp_.jpg,Reebok,"Customers find these work shoes comfortable, chic, and of good quality, with one customer noting they're suitable for medical school. The shoes receive mixed feedback regarding slip resistance, with several customers reporting they slide on restaurant floors. Customers disagree on the fit and arch support, with some finding them narrow and needing more arch support. Durability is also mixed, with some saying they last a long time while others report them falling apart after 6 months of use.",Women,very comfortable can be worn all day true to size
Reebok Womens Zig Dynamica,4.2,70.0,https://m.media-amazon.com/images/I/71sRUkiVjnL._AC_SX395_SY395_QL70_FMwebp_.jpg,Reebok,"Customers find these sneakers comfortable and cute-looking, with great arch support and ample cushioning. The shoes come in multiple colors and receive positive feedback for their quality. However, customers disagree on the fit, with some reporting they run small. Moreover, the build quality is concerning, with multiple customers reporting that the shoes are falling apart.",Women,"These are on the heavy side and sturdy shoe but that’s what I wanted. I am no longer buying Nike so I need to find something else and this is a super stylish, fun shoe. I wear them playing volleyball and are very comfortable. Highly recommend!"
Reebok Womens Zig Dynamica 5,4.5,27.0,https://m.media-amazon.com/images/I/71b9-BKVy7L._AC_SX395_SY395_QL70_FMwebp_.jpg,Reebok,"Customers find these running shoes comfortable, nice-looking, and of high quality. They appreciate the traction, with one customer noting they're perfect for the gym. The fit receives mixed feedback - while some say they run true to size, others find them a little snug in the width.",Women,these are the cutest tennis shoes! also very comfortable - I
Reebok Womens Zig Dynamica STR,5.0,45.0,https://m.media-amazon.com/images/I/71Lr9S1y8GL._AC_SY395_SX395_QL70_ML2_.jpg,Reebok,No summary available.,Women,Very comfortable
Reebok Womens Zig Dynamica Str,4.6,56.0,https://m.media-amazon.com/images/I/812eggdWYwL._AC_SX395_SY395_QL70_FMwebp_.jpg,Reebok,"Customers find these running shoes comfortable, with one mentioning their feet no longer hurt, and appreciate their style, particularly noting the all-white with tan sole design. The shoes fit true to size, are lightweight, and receive positive feedback for their quality, with one customer noting they're better than Hokas for running. They like the balance features, with one mentioning the flared sole provides stability when walking, and consider them worth the price.",Women,"I really like these shoes, and they are very comfortable. I have worn these 100"
Reebok Womens Zignition,4.5,66.0,https://m.media-amazon.com/images/I/61oBkF+xUGL._AC_SX395_SY395_QL70_ML2_.jpg,Reebok,No summary available.,Women,If you need comfort these shoes are for you. They are awesome and they look great. I love them.
Reebok Womens Ztaur,4.3,58.0,https://m.media-amazon.com/images/I/71RlZUt0kVL._AC_SX395_SY395_QL70_FMwebp_.jpg,Reebok,"Customers find these running shoes comfortable and appreciate their style, particularly the color options. They are functional, with one customer noting they're useful for long working days. The material quality receives mixed feedback, with some praising the quality while others criticize it. Customers disagree on the fit and value for money. The durability is concerning, with multiple customers reporting issues with the material tearing.",Women,These are good looking shoes. Very light weight and comfortable.
Reebok Work Nano Tactical Mens Boot,3.9,76.0,https://m.media-amazon.com/images/I/61K7wcZXyZL._AC_SY395_SX395_QL70_FMwebp_.jpg,Reebok,"Customers find these sneakers comfortable and appreciate their material quality, with one noting they feel like the original versions. They are suitable for fitness activities, with one customer mentioning they work well for crossfit and functional training. The fit receives mixed feedback, with several customers noting the toe box is too narrow. The firmness and style also get mixed reviews.",Men,Great lifting shoe. Not so much for running or daily walking!
Reebok Work Zig Pulse Work CT Mens Oxford,3.8,50.0,https://m.media-amazon.com/images/I/61XU6NEQ2KL._AC_SY395_SX395_QL70_FMwebp_.jpg,Reebok,"Customers find these work shoes comfortable, lightweight, and appreciate their protective features, with one customer specifically noting the composite safety toe cap. They receive positive feedback for their slip resistance, with one customer mentioning good grip to the ground. The build quality and sizing receive mixed reviews - while some find them nice, others complain about poor insoles, and while some say they run large, others report they're not true to size. The durability is concerning, with multiple customers reporting the shoes falling apart within weeks of use.",Men,Seems to be great. Very comfortable. As always with any reebok shoe I ordered a size 12 because they run small. In pretty much all other brand shoe I wear a 11 us size so bear that in mind when you purchase. If you use the size guide and put in your normal size it will tell you the same size is recommended but do not do this as it will not be enough to room. Goe one size bigger for good toe room
Reebok Zig Dymanica 5 for Women,4.3,70.0,https://m.media-amazon.com/images/I/81qAnyUnomL._AC_SY395_SX395_QL70_FMwebp_.jpg,Reebok,"Customers find these running shoes cute in style and appreciate their quality, with one customer noting they're great for running. The shoes receive mixed feedback regarding comfort, with some finding them very comfortable while others say they're uncomfortable. Customers disagree on the sizing, with several noting they're much narrower than expected and not true to size. The cushion quality and flexibility also get mixed reviews, with some finding the cushion nice while others say they're stiff.",Women,I think these are my new favorite & most comfortable shoe! I think they run slightly small. I’m a 9.5 but I typically get 10’s because I like a little room. These 10’s IMO fit like a 9.5. I still LOVE them! I have never really worn Reebok’s so I didn’t know how’d they’d fit. Very happy I bought these & I love the color!!
Reebok Zignition for Men,4.8,66.0,https://m.media-amazon.com/images/I/719PYy16izL._AC_SY395_SX395_QL70_FMwebp_.jpg,Reebok,Customers find these running shoes comfortable and well-built. They also appreciate the good value for money.,Men,"Reebok has delivered an excellent option for anyone who loves cushioned shoes. The Zignition is just as comfortable as HOKAs, yet comes at nearly half the price. The build quality is outstanding, as you would expect from Reebok.Keep in mind that the sizing runs about half a size larger compared to other brands - if you normally wear a size 11 in Adidas, Under Armour, or Skechers, you"
Reebok Zignition for Women,4.2,66.0,https://m.media-amazon.com/images/I/71qcNVd1ogL._AC_SY395_SX395_QL70_FMwebp_.jpg,Reebok,"Customers find these running shoes bouncy and comfortable, with good cushioning. The sizing receives mixed feedback.",Women,Are good for someone who is on their feet all day
Reebok womens,4.4,43.0,https://m.media-amazon.com/images/I/61VQj0IcITL._AC_SY395_SX395_QL70_FMwebp_.jpg,Reebok,"Customers find these running shoes comfortable, with one mentioning their feet don't hurt or get tired while wearing them. Moreover, the shoes receive positive feedback for their quality, with one customer noting they're great for all-day walking. Additionally, customers like the color, describing it as amazing. However, customers disagree on the sizing, with some finding them too small.",Unisex,I took the advice from others to size up. I usually wear a size 9 or 9 1/2 in tennis shoes. I bought a size 10 and they fit perfectly. Very comfortable on out of the box. I would say a nice burnt orange color. I haven’t taken them jogging yet but they seem to be nice quality just by the look and feel of them on around the house.
adidas Baby Lite Racer Adapt 70,4.6,40.0,https://m.media-amazon.com/images/I/71FOwmOCFZL._AC_SY395_SX395_QL70_ML2_.jpg,Adidas,"Customers find these shoes to be of good quality, easy to slip on and off, and comfortable, with one customer noting they're particularly suitable for children with narrow feet. They receive positive feedback for their style and are considered great for toddlers. The durability receives mixed reviews - while some say they hold up well, others report laces breaking within a month. Customers disagree on the sizing, with some finding them true to size while others say they run small.",Unisex,"Perfect for my son, comfortable breathable and dark color for the dirty. Fits good. Lovely design! 💯"
adidas BabyBoys Ubounce DNA,4.6,45.0,https://m.media-amazon.com/images/I/81R1iKZ6NxL._AC_SX395_SY395_QL70_FMwebp_.jpg,Adidas,"Customers find these shoes comfortable, well-fitting, and stylish, appreciating their lightweight design and good value for money. The durability and ankle support receive mixed feedback - while some say they're durable and provide good support, others report top rips and lack of ankle support.",Unisex,Bought for my grandson. He loves them. Comfortable and great color. Deep red.
adidas Boys Racer Tr23,4.6,32.0,https://m.media-amazon.com/images/I/71YTDEHTkRL._AC_SY395_SX395_QL70_ML2_.jpg,Adidas,"Customers find these sneakers well-made, comfortable, and lightweight, appreciating their style with a lite gray pinkish hue. The shoes fit great and are easy to slip on and off. While some customers say they wear well for months, others report them coming apart after three wears. The size and Velcro features receive mixed feedback, with some finding them true to size while others say the sizing is off, and some noting the Velcro holds well while others report issues.",Unisex,"These toddler athletic shoes are lightweight, supportive, and easy to slip on and off. They stay secure during play and keep little feet comfortable all day. Great quality and super cute, too!"
adidas Boys Ultradream Dna Elastic Lace,4.5,43.0,https://m.media-amazon.com/images/I/71ttpnv2FWL._AC_SX395_SY395_QL70_ML2_.jpg,Adidas,"Customers find these shoes comfortable and easy to slip on and off. They like the fit, with one customer noting the wider toe boxes, and appreciate the quality. The laces receive positive feedback, with one customer mentioning they are elastic.",Unisex,Perfect fit and comfortable! Love how the laces are elastic and you don’t have to worry about anything coming untied. Easy to put on and get off!
adidas Mens,4.5,55.0,https://m.media-amazon.com/images/I/71qSXt92HhL._AC_SX395_SY395_QL70_FMwebp_.jpg,Adidas,"Customers find these sneakers comfortable enough to wear all day, with great arch support and good value for money. They are lightweight and versatile, working well for gym workouts and HIIT sessions. The fit receives mixed feedback - while some say it's true to size, others report they run big.",Men,"These Adidas sneakers are brutal. They have a modern design that combines sport with a feminine touch thanks to the details in pink, white and orange. They are super comfortable, lightweight and the mesh at the top makes your feet not hot.The padded sole makes walking or exercising much smoother, and as a good Adidas classic, the three stripes on the side cannot be missed. Perfect to wear all day, either for training or just to go out in style."
adidas Mens Adistar 3,4.4,80.0,https://m.media-amazon.com/images/I/51JfZjkiPiL._AC_SY395_SX395_QL70_FMwebp_.jpg,Adidas,"Customers find these running shoes to be ultra-cushioned and extremely comfortable, with one customer noting they're suitable for all-day wear. They appreciate the lightweight design.",Men,"These are ultra cushioned and really lite sneakers. Maybe too cushioned, still these are now my favorite of all time. Naturally I have 2 pairs. Easy to put on which is a requirement for me. Easy to take off. If you will be walking all day, these will easily do the job. Stylish as well."
adidas Mens Adizero Evo Sl M,4.5,151.0,https://m.media-amazon.com/images/I/611RBbG6pYL._AC_SY395_SX395_QL70_FMwebp_.jpg,Adidas,"Customers find these running shoes comfortable, lightweight, and appreciate their true-to-size fit, with one customer noting plenty of room in the toebox. The shoes receive positive feedback for their color, with one customer describing the Lucid lemon shade as ""unbelievably beautiful."" Customers like the cushioning and find them suitable for jogging. The stability receives mixed reviews.",Men,"My new favorite runners! I have 6 pairs of really nice running shoes now that I will alternate between but I think these will get the preference and definitely on race day.The GOOD: The fit is perfect even though that is a bit subjective. They have very good heel support and the toe is great, with good support and springy take off! The toe box is very comfortable on my size 13 normal width (D) feet. I like the reinforced eyelets. Very good traction. The arch support is very nice too. They feel light and lively.The BAD: The shoe strings are crap and will definitely get replaced. The tongue is non-gusseted but has a loop on the tongue that allows the second and third lace to go through it and help control positioning. I prefer a gusseted tongue.These are brand new, I just got them today. Opened the box and went for a quick 5 mile run so can"
adidas Mens Alphaboost Knit Performance ShoesRunning,4.4,53.0,https://m.media-amazon.com/images/I/71kAfkck06L._AC_SX395_SY395_QL70_FMwebp_.jpg,Adidas,"Customers find these running shoes comfortable, with one describing them as feeling like walking on pillows, and appreciate their style and good price. The fit receives mixed feedback, with some finding them perfect while others say they run slightly big. Customers disagree on the arch support and durability, with some finding them strong while others report them being unbalanced.",Men,I got a good price on them I purchased 2 pairs first pair lasted a while I finally wore second pair still use first pair for when it’s raining there super comfortable good looking I’d definitely recommend them very nice
adidas Mens Alphaboost V2,4.4,60.0,https://m.media-amazon.com/images/I/81lRWekWKhL._AC_SY395_SX395_QL70_ML2_.jpg,Adidas,No summary available.,Men,They came quicker than expected. Good shoes for my long walks
adidas Mens Amplimove Training,4.4,50.0,https://m.media-amazon.com/images/I/815gVTexPJL._AC_SX395_SY395_QL70_ML2_.jpg,Adidas,"Customers find these sneakers well-made, comfortable, and lightweight, with decent arch support and a nice appearance. They appreciate their versatility, being suitable for both gym workouts and everyday wear, and consider them good value for money. The fit receives mixed feedback, with some finding them as recommended while others note they run a bit tight on the width.",Men,Perfect training shoes. Comfortable and enough support. They run a little big.
adidas Mens Astrastar,4.7,76.0,https://m.media-amazon.com/images/I/717kUey85hL._AC_SX395_SY395_QL70_FMwebp_.jpg,Adidas,"Customers find these sneakers comfortable and good value for money, with one mentioning they're suitable for working out. The fit receives mixed feedback, with some finding them great while others say they're a bit snug.",Men,They very comfortable and I love them will be getting another pair
adidas Mens Avery,4.3,45.0,https://m.media-amazon.com/images/I/71I1vY9uUJL._AC_SX395_SY395_QL70_FMwebp_.jpg,Adidas,"Customers find these running shoes to be high quality, comfortable, and great value, with one customer noting they don't hurt their feet. The style receives positive feedback for looking great, though opinions about color are mixed. Customers disagree on the sizing, with some finding them big while others say they run too long. The material quality and slipperiness also receive mixed reviews.",Men,"This is a great looking running/lifestyle shoe, mainly for its silhouette from different views of point.Yes, it does run a bit long, but choosing one’s regular size would still do it without an issue.The upper seems built in three layers of synthetic materials, rendering a certain degree of richness, while eyelets islands seem to be of real leather, good for some contrast and to touch.The unique feature of this model Avryn, which I appreciate it very much, is the dual foams midsole, i.e. Boost + Bounce, or PU + EVA, each has their own characteristics, PU for good cushioning and longevity while EVA for bouncing. To put them together in a sensible way costs extra for sure, that’s a good value there.True, it doesn’t fit as snugly as most other shoes we see, but counting on so many good and unique features of Avryn, it is a good model to have.Mine is the White/Zero Metallic. It has basically four different shades of white, white, cream, beige and chalk white. I love the subtlety it presents.Overall, a great design, thumbs up!"
adidas Mens Barreda Decode,4.6,40.0,https://m.media-amazon.com/images/I/71vBdTDx3-L._AC_SY395_SX395_QL70_FMwebp_.jpg,Adidas,"Customers find these sneakers comfortable, well-made, and lightweight, appreciating their perfect fit and good value for money. They like the style and color, with one customer particularly praising the yellow shade in these Adidas shoes. Regarding size, while some customers find them perfect, others mention they run narrow.",Men,"The Barreda Decode Addidas mens sneakers is extremely comfortable footwear. The build quality is excellent, they provide good slip resistance. The fit is true and the design and style gives that Ole school finish which I like. I"
adidas Mens Cloudfoam Comfy Elastic Lace,4.7,48.0,https://m.media-amazon.com/images/I/61H89C51VRL._AC_SY395_SX395_QL70_FMwebp_.jpg,Adidas,"Customers find these shoes comfortable, stylish, and lightweight, with good cushioning. They fit well on wide feet and are easy to slip on and off. Customers appreciate their wearability, particularly for walking, and one customer mentions they're great for long days on their feet.",Men,"These sneakers are supreme as far as comfort. True to size. Good support all day, great for walking and going to the gym. It"
adidas Mens CrazyChaos 2000,4.5,55.0,https://m.media-amazon.com/images/I/81SvtwyH6rL._AC_SX395_SY395_QL70_ML2_.jpg,Adidas,"Customers find these running shoes comfortable, well-made, and stylish, appreciating their good fit and lightweight design. They consider them good value for money. The cushioning receives mixed feedback - while some customers like the cushioning, others report blisters during longer runs. Customers disagree on whether the shoes run true to size.",Men,"The sneakers are comfortable and provide good support for everyday wear. The design looks stylish and matches the description. Fit is true to size, and the quality of materials feels solid. Overall, a reliable pair for casual use."
adidas Mens Duramo Sl,4.5,46.0,https://m.media-amazon.com/images/I/81SyL6NGAjS._AC_SX395_SY395_QL70_FMwebp_.jpg,Adidas,"Customers find these running shoes comfortable, well-fitting, and of good quality, with one customer noting they're better than expensive sneakers. They receive positive feedback for their style, particularly the blue color, and customers appreciate their lightweight design and value for money. The durability and support aspects receive mixed reviews - while some customers say they provide good support, others report no support at all.",Men,"Most 12s are a tad small. Addidas is true to size. Light weight, solid, good cushion, NO arch support. Laces are ridiculously long. But all in all, I like them a bit better than my typical Saucony cohesion model I usually buy off Amazon. And for $46, it"
