product,rating,price,img_url,brand,customer_say,gender,individual_review
PUMA Womens Amplifier,4.4,35.0,https://m.media-amazon.com/images/I/41TrKNvOkuL._AC_SY395_SX395_QL70_FMwebp_.jpg,PUMA,"Customers find these sneakers comfortable, with one mentioning they don't hurt when walking, and appreciate their style, quality, and value for money. The shoes receive positive feedback for their fit and support, with one customer noting the arch support feels good, and another mentioning they help with hip pain. Customers disagree on the sizing, with some finding them true to size while others say they're a bit large.",Women,"Comfortable. Love the neutral color. Stylish. Great value for the money. I used to think I had to buy Nike’s….well, I still purchase them but I am absolutely becoming a Puma fan. Not regrets!"
PUMA Womens Axelion,4.4,19.0,https://m.media-amazon.com/images/I/514nOseksaL._AC_SY395_SX395_QL70_ML2_.jpg,PUMA,"Customers find these sneakers comfortable, soft inside with plenty of padding, and appreciate that the colors match the pictures exactly. The shoes receive positive feedback for their quality, with one customer noting they're great for gym and running activities, and another highlighting the fantastic arch support. Regarding fit, while some customers find them perfect, others mention they run slightly larger than expected.",Women,"I love a great walking/running shoes, especially when it fits comfy and there"
PUMA Womens Cell Lightspeed Black,5.0,35.0,https://m.media-amazon.com/images/I/51uY9VNsZHL._AC_SY395_SX395_QL70_FMwebp_.jpg,PUMA,No summary available.,Women,Comfy... Great shoe! This shoe is the perfect fit.
PUMA Womens Cell Phase Femme Black,4.4,13.0,https://m.media-amazon.com/images/I/51Suc2aA2dL._AC_SY395_SX395_QL70_ML2_.jpg,PUMA,No summary available.,Women,"I ordered my second pair, the gray and white and again it arrived earlier than expected. It fits true to size. They are light and comfortable if you work on your feet. The pink is a little off on the black ones but the quality outweighs that flaw. I love these and worth every penny!"
PUMA Womens Club 5v5,4.4,61.0,https://m.media-amazon.com/images/I/41LZr7YleZL._AC_SY395_SX395_QL70_FMwebp_.jpg,PUMA,"Customers find these sneakers comfortable, cute, and of good quality, appreciating their versatility for both casual and dressy outfits. The color receives positive feedback, and customers consider them a great value. The fit receives mixed reviews, with some finding them true to size while others say they run small, and the material quality is also mixed, with some praising the material while others find it hard and stiff.",Women,"This was gift for my daughter overseas. Seem not only FedEx and UPS have sometimes trouble to delivery products, finally arrived. The shoes and other products in the package arrived after some delays. The package seems went through a lot but the items inside was in perfect shape. My daughter said it"
PUMA Womens Contempt Demi,4.3,40.0,https://m.media-amazon.com/images/I/51vI0aPfLUL._AC_SY395_SX395_QL70_FMwebp_.jpg,PUMA,"Customers find these trainer shoes comfortable, well-made, and cute in style, offering great value for the price. The fit receives mixed feedback, with some finding them perfect while others say they're too tight. The cushioning and color aspects also get mixed reviews.",Women,I love how stable these shoes are. I just started to get into lifting heavy and these have been comfortable and secure
PUMA Womens Darter Pro,4.6,57.0,https://m.media-amazon.com/images/I/71CT18VE5KL._AC_SX395_SY395_QL70_FMwebp_.jpg,PUMA,"Customers find these running shoes comfortable, well-fitting, and true to size. They appreciate the shoes' quality and style, noting they walk and look good, with beautiful colors. Customers find them great for running, with one mentioning they make running easier.",Women,"Best running shoes. These are lightweight, comfortable, and make running easier. I find I have less foot and leg pain after switching to these. The colors are absolutely beautiful as well."
PUMA Womens Fier Nitro Tonal Lace Up Casual Pink Size 65 M,5.0,35.0,https://m.media-amazon.com/images/I/51-gXtYPiJL._AC_SX395_SY395_QL70_FMwebp_.jpg,PUMA,No summary available.,Women,Very comfortable and great for running.
PUMA Womens Flexfocus Lite Better Knit Cross Training,4.4,35.0,https://m.media-amazon.com/images/I/41P-0dYIBUL._AC_SY395_SX395_QL70_ML2_.jpg,PUMA,Customers find these shoes comfortable and of great quality.,Women,This shoe is very comfortable would definitely recommend
PUMA Womens Foreverrun Nitro,3.7,95.0,https://m.media-amazon.com/images/I/71PPs7yuB-L._AC_SX395_SY395_QL70_ML2_.jpg,PUMA,No summary available.,Women,New favorite daily trainer—got a really bad blister using it for my first run—but fine after that. This is my 2nd pair! Wore my 1st pair until they pretty much fell apart! Good for flat footed heel strikers like me.
PUMA Womens Graviton,4.4,49.0,https://m.media-amazon.com/images/I/61lWH4RukIL._AC_SY395_SX395_QL70_ML2_.jpg,PUMA,No summary available.,Women,"Comfortable and stylish. This is my second pair of Pumas this year and when I saw these, I had to get them. I normally wear a 7 but these are just a tad extra room around the row so my toe is comfortable and not rubbing. There is a break in period as they are initially for me a little stuff but after the first day, they were good to go. Must try"
PUMA Womens Hypnotic Leather,4.6,,https://m.media-amazon.com/images/I/71gQkhmC95L._AC_SY395_SX395_QL70_FMwebp_.jpg https://m.media-amazon.com/images/I/71OA6P+6tDL._AC_SY395_SX395_QL70_FMwebp_.jpg,PUMA PUMA,No summary available. Customers find these shoes comfortable and well-made. They like the colors and appreciate that they fit perfectly.,Women Women,I got these for work. They are very comfortable as I’m walking all day. They are true to size. The color is good. Very light weight
PUMA Womens Pacer 23,4.6,53.0,https://m.media-amazon.com/images/I/71ACb32KeoL._AC_SY395_SX395_QL70_FMwebp_.jpg,PUMA,"Customers find these sneakers comfortable, with one noting no blisters or rubbing, and appreciate their style and color. The shoes receive positive feedback for their quality, fit, cushioning, and wearability, particularly for walking. Regarding size, while some find them true to size, others report they run too small. Moreover, durability receives mixed reviews, with some finding them durable while others report issues with stitching coming undone.",Women,These PUMA women
PUMA Womens Prowl Slipon Shine WnsCross Trainer,4.7,51.0,https://m.media-amazon.com/images/I/615faY1PdfL._AC_SY395_SX395_QL70_ML2_.jpg,PUMA,"Customers find these sneakers comfortable, lightweight, and easy to slip on, describing them as ""feather light on my feet"" and ""slide on like butter."" They appreciate the fit, style, and feel, noting they look and feel great, with one customer mentioning they're perfect for school wear. The support receives mixed feedback - while some customers find it great for high arches, others say it's not enough.",Women,Still wearing a pr I bought elsewhere about 4 yrs ago. They are super comfy and still in pretty good shape. I wear a few times a week mostly for running errands. Saw these and decided to buy another pair. Was concerned about some of the neg feedback. Maybe they aren
PUMA Womens Pulse Pro,4.4,54.0,https://m.media-amazon.com/images/I/617NT7O-JEL._AC_SY395_SX395_QL70_FMwebp_.jpg,PUMA,"Customers find these running shoes to be of good quality, with one mentioning they are great for novice runners and walkers. The design receives positive feedback, with customers describing them as beautiful.",Women,Comfortable and great support for running.
PUMA Womens Riaze Prowl,4.4,,https://m.media-amazon.com/images/I/51eZAw5qm4L._AC_SY395_SX395_QL70_FMwebp_.jpg https://m.media-amazon.com/images/I/51yjhJ8byWL._AC_SY395_SX395_QL70_FMwebp_.jpg,PUMA PUMA,"Customers find these sneakers comfortable enough to wear all day without discomfort, with top-notch quality and a cushiony foam insole that feels good to put on. They are lightweight and suitable for various activities including walking, jogging, and outdoor dancing, with one customer noting they're great for long-distance walking. While some customers find them true to size, others mention they run a little big. Customers find these shoes comfortable, great-looking, and soft, with good durability and value for money. They receive positive feedback for their quality, with one customer noting they're suitable for sports activities. The fit and support receive mixed reviews - while some find them a perfect fit with good support, others report they run too small and lack arch support.",Women Women,Very conformable great quality I work them to work 8 hour shifts at work when it home my feet don’t even hurt
PUMA Womens Riaze Prowl Cross Trainer,4.4,50.0,https://m.media-amazon.com/images/I/71xX+mHmkUL._AC_SX395_SY395_QL70_ML2_.jpg,PUMA,"Customers find these shoes comfortable, good-looking, and appreciate their quality and value for money. The cushioning receives positive feedback, with one customer noting the super soft air cushion sole that absorbs forces. While some customers report their feet don't hurt, others mention blisters, and while some find the shoes provide excellent arch support, others say they don't offer enough support. The fit runs small according to multiple reviews.",Women,"These PUMA Riaze Prowl trainers are exactly what I was hoping for. The fit is true to size and super comfortable, even after wearing them all day. The cushioning gives really good support, especially for walking or light workouts, and I don’t end up with sore feet like I do in other sneakers. They’re also lightweight, so I don’t feel weighed down.On top of that, they look great. Sleek design, clean lines, and they go with just about everything from workout gear to jeans. I’ve already gotten compliments on them. If you want sneakers that feel good and look good, these are a win."
PUMA Womens Run Xx Nitro Black,4.0,55.0,https://m.media-amazon.com/images/I/517rJWMK11L._AC_SY395_SX395_QL70_FMwebp_.jpg,PUMA,"Customers have mixed opinions about these running shoes, with some finding them nice-looking and comfortable, while others report they hurt their heels and have sizing issues. Moreover, the slip resistance receives negative feedback, with one customer mentioning that the side lines came off the shoe.",Women,Love these very comfortable
PUMA Womens Softride Frequence,3.5,73.0,https://m.media-amazon.com/images/I/71kUkqlny3L._AC_SX395_SY395_QL70_FMwebp_.jpg,PUMA,No summary available.,Women,"Absolutely love these shoes. True to size, comfortable, stylish, and easy to get on and off. I wish I could find them in other colors."
PUMA Womens Softride Harli Slip on Training,4.4,50.0,https://m.media-amazon.com/images/I/61qjL42G7uL._AC_SY395_SX395_QL70_FMwebp_.jpg,PUMA,"Customers find these shoes comfortable, stylish, and perfect for walking a lot, with one customer noting they feel like walking on a pillow. They slip on easily and receive positive feedback for their quality and cushioning. The fit and sturdiness receive mixed reviews - while some find them great, others mention they're not as snug as expected, and while some describe them as sturdy, one customer reports issues with the sole coming off.",Women,Fits true to size. I have narrow feet so no issue with width. The soles are super comfortable and soft. Easy to slip on and feels secure. They just arrived today so I can’t speak to longevity. Good quality for the price.
PUMA Womens Softride Harli Slipon Cross Training,4.0,28.0,https://m.media-amazon.com/images/I/41pu6imj5SL._AC_SY395_SX395_QL70_FMwebp_.jpg,PUMA,Customers find these shoes comfortable and nice-looking. One customer mentions that they complement many outfits in their wardrobe.,Women,This shoe looks so good with pants and maxi dresses! The colors are so versatile and complement many outfits in my wardrobe. I have foot-issues and installed my orthotics no problem. But the were comfortable even before. The stretch fabric holds. Its shape and the shoe looks very classy. Wish I’d bought 2 pair!!
PUMA Womens Softride Harmony Cross Training,4.5,66.0,https://m.media-amazon.com/images/I/71YcddomRgL._AC_SY395_SX395_QL70_FMwebp_.jpg,PUMA,"Customers find these training shoes comfortable, with a perfect fit and great quality. They are stylish, lightweight, and one customer describes them as feeling like walking on pillows. The support receives mixed feedback from customers.",Women,"Soooooo cute! Super comfy, too! I really love the way they look and feel. Very supportive and I followed the recommended size of 9 which is one up from my US 8. They fit great! I can"
PUMA Womens Softride Mayve,4.5,50.0,https://m.media-amazon.com/images/I/81NAAqqWdiL._AC_SX395_SY395_QL70_FMwebp_.jpg,PUMA,"Customers find these running shoes comfortable, with feet not hurting during use, and appreciate their good quality and style. The shoes offer excellent cushioning and support, with one customer noting the internal lift allows for movement, and customers consider them worth the money. Regarding size, while some find them true to size, others report they run too narrow.",Women,"I always always bought that swoosh brand, but they"
PUMA Womens St Miler,4.7,,https://m.media-amazon.com/images/I/81delMduGjL._AC_SY395_SX395_QL70_FMwebp_.jpg https://m.media-amazon.com/images/I/71H0Z7nRNXL._AC_SY395_SX395_QL70_FMwebp_.jpg,PUMA PUMA,"Customers find these sneakers comfortable and well-fitting, particularly noting they work well for wide feet. They appreciate the beautiful color and find them cute. Customers find these sneakers comfortable and true to size, with plenty of room in the toe box, making them particularly suitable for narrow feet. They appreciate the colors, noting they match well with athleisure and casual outfits, and find them worth the price. Customers like the look, style, and soft feel of the shoes.",Women Women,"These are cute, but I wish they were all suede on the pink part. I didn’t realize it’s like a plastic mesh type fabric. Not exactly what I was going for. They’re a beautiful bubble gum pink and navy. I sent mine back because I didn’t love them as much in person and decided to get a more neutral color to match more of my clothes. I did try them on though and they were really comfortable and fit true to size."
PUMA Womens Twitch RunnerSneaker,4.4,30.0,https://m.media-amazon.com/images/I/51Qpd3aOtsL._AC_SY395_SX395_QL70_ML2_.jpg,PUMA,"Customers find these running shoes comfortable, well-made, and lightweight, with great arch support and true-to-size fit. They appreciate the appearance, with one customer noting the rose gold color is slightly shimmery, and another mentioning there's a big selection of colors to choose from.",Women,"These are high quality, super comfortable, true to size, lightweight and pretty. The rose gold is slightly shimmery, which I loved.My daughter liked mine so much, I had to buy her a pair also."
PUMA Womens Velocity Nitro 3,4.7,136.0,https://m.media-amazon.com/images/I/51wkJiBJ0TL._AC_SY395_SX395_QL70_ML2_.jpg,PUMA,"Customers find these running shoes to be of great quality, with one mentioning they work well for high-intensity workouts like Hyrox and F45. They fit well, and customers find them comfortable.",Women,"I’ve been using these shoes for Hyrox training and F45 workouts, and I absolutely love them. They’re super lightweight but still offer great stability, which is key for all the lateral movements and strength exercises. They feel really secure during sled pushes, jumps, and runs, and I never feel weighed down.The fit is comfortable, and they’ve held up well with regular training. If you’re looking for a solid cross-training shoe that can handle high-intensity functional workouts, these are a great choice. Highly recommend!"
PUMA Womens Velocity Nitro 3 Hyrox White,5.0,130.0,https://m.media-amazon.com/images/I/61LkFPM0UrL._AC_SY395_SX395_QL70_FMwebp_.jpg,PUMA,No summary available.,Women,Love them o go them for my upcoming hyrox race and love them
PUMA Womens Voltaic Evo Cross Trainer,4.4,65.0,https://m.media-amazon.com/images/I/713jKSN599L._AC_SY395_SX395_QL70_FMwebp_.jpg,PUMA,"Customers find these sneakers comfortable, stylish, and of outstanding quality. They appreciate the cushioning, with one customer comparing it to walking on pillows, and another noting the arch support works perfectly. Customers disagree on whether the shoes run true to size.",Women,"Narrow, typical of the style. Cute, comfortable."
PUMA Womens Voltaic Evo Cross Training,4.4,65.0,https://m.media-amazon.com/images/I/718b9tCrLuL._AC_SX395_SY395_QL70_FMwebp_.jpg,PUMA,"Customers find these sneakers comfortable, well-made, and appreciate their fit, style, and cushioning with soft foam. The color receives positive feedback from customers. However, the shoes show durability issues, with multiple customers reporting holes developing near the toe guard after just a few months of wear. Customers disagree on whether the shoes run true to size.",Women,Comfortable and fits to size
Puma UnisexChild Softride One4all Slip on,3.0,48.0,https://m.media-amazon.com/images/I/617RrwZJD7L._AC_SY395_SX395_QL70_FMwebp_.jpg,PUMA,No summary available.,Unisex,"Far too tight and narrow for my 4 y/o. This is a not a great shoe for growing and developing foot strength.It’s pretty, though."
Puma UnisexChild Voltaic Evo Cross Training,5.0,44.0,https://m.media-amazon.com/images/I/519CKTeLi7L._AC_SY395_SX395_QL70_FMwebp_.jpg,PUMA,No summary available.,Unisex,Grandson loved them!!
Puma Womens Better Foam Prowl Slip on,4.4,40.0,https://m.media-amazon.com/images/I/61i06fOLdOL._AC_SY395_SX395_QL70_FMwebp_.jpg,PUMA,"Customers find these sneakers comfortable, well-made, and lightweight, with a timeless black look. The fit and slip resistance receive mixed feedback - while some find them easy to slip on, others report they're too tight and difficult to put on. Customers disagree on the sizing, with some noting they run small. The durability is also mixed, with some saying they're durable while others report the shoes falling apart.",Women,I have had similar mesh type shoes and they stretch with a break in. First impression was
Puma Womens Tazon 6 Graphic Lace Up,4.4,50.0,https://m.media-amazon.com/images/I/71LLwbf-gRL._AC_SX395_SY395_QL70_ML2_.jpg,PUMA,"Customers find these sneakers comfortable, well-fitting, and of excellent quality, appreciating their feminine look and great arch support. They consider them fantastic for the price. The size and cushioning receive mixed feedback - while some find them true to size with a soft gel-sole insole, others note they run larger and are very stiff.",Women,"These were given as an act of kindness, and she absolutely loved them! Great quality, stylish, and comfortable. Fits true to size."
Reebok Boys Court Advance,4.8,31.0,https://m.media-amazon.com/images/I/61Tq4N6+5+L._AC_SY395_SX395_QL70_FMwebp_.jpg,Reebok,No summary available.,Unisex,Great shoe perfect fit love the colors great quality hard to find but Amazon has it all thanks
Reebok Boys Road Supreme 40,4.5,39.0,https://m.media-amazon.com/images/I/71cgxOs3bRL._AC_SX395_SY395_QL70_FMwebp_.jpg,Reebok,No summary available.,Unisex,My grandson loves these. He wears them over every shoe he has so they must be comfortable. He also loved the food on them.
Reebok Boys XT Sprinter SlipOn,4.5,,https://m.media-amazon.com/images/I/619rBhRZYGL._AC_SX395_SY395_QL70_ML2_.jpg https://m.media-amazon.com/images/I/51mrk92CnXL._AC_SY395_SX395_QL70_ML2_.jpg,Reebok Reebok,"Customers find these running shoes to be of good quality, comfortable, and easy to put on and take off, with a great fit and nice appearance. The durability receives mixed feedback - while some say they hold up well, others note they're not the most long-lasting. The sizing is also mixed, with some finding them true to size while others need to size up a bit. The fabric quality receives negative feedback, with one customer noting it looks worn after a few months of use. Customers find these running shoes to be of good quality, comfortable, and easy to put on and take off, with a great fit and nice appearance. The durability receives mixed feedback - while some say they hold up well, others note they're not the most long-lasting. The sizing is also mixed, with some finding them true to size while others need to size up a bit. The fabric quality receives negative feedback, with one customer noting it looks worn after a few months of use.",Unisex Unisex,The sneakers are perfect just as described and they fit its the right color
Reebok Campio XT Mens,4.4,40.0,https://m.media-amazon.com/images/I/711gW0gbgLL._AC_SY395_SX395_QL70_FMwebp_.jpg,Reebok,"Customers find these sneakers comfortable, true to size, and great for daily wear, with one customer noting they're particularly suitable for slender feet. They receive positive feedback for their durability, chic appearance, and green color, while also offering good value for money. The leather quality receives mixed reviews, with some customers noting they're made of synthetic material rather than leather.",Men,"These are awesome shoes, they have a retro look and their are comfortable. Fits true to size."
Reebok Classic Nylon Mens Tennis,4.6,48.0,https://m.media-amazon.com/images/I/714EmUHrtEL._AC_SY395_SX395_QL70_FMwebp_.jpg,Reebok,"Customers find these sneakers comfortable, well-made, and appreciate their perfect fit. They describe them as classic cool Reeboks that hold up for years, with one customer noting their sleek leather design. Customers consider them decent for the price. The color receives mixed feedback from customers.",Men,Excellent shoes. Great fit. very comfortable.
Reebok Club C Revenge Unisex,4.5,45.0,https://m.media-amazon.com/images/I/510SbNrt8aL._AC_SY395_SX395_QL70_FMwebp_.jpg,Reebok,"Customers find these sneakers comfortable and well-fitting. They appreciate the shoes' appearance, with one customer describing them as ""fricken ADORABLE.""",Unisex,"fits perfectly and looks cool too , Love it"
Reebok Floatzig for Men,4.6,,https://m.media-amazon.com/images/I/51CTYmLeWOL._AC_SY395_SX395_QL70_FMwebp_.jpg https://m.media-amazon.com/images/I/71zM0ROkuOL._AC_SY395_SX395_QL70_FMwebp_.jpg,Reebok Reebok,"Customers find these running shoes comfortable and appreciate their excellent cushioning, with one noting the responsive nature of the cushioning. They receive positive feedback for their appearance, fit, and value for money. Customers disagree on the stability of the shoes. Customers find these running shoes comfortable, well-made, and stylish, with good cushioning and a great fit. The durability receives mixed feedback - while some find them durable, others report that the sole falls apart within 6 months. Customers disagree on the support, with some praising it while others find it inadequate. Value for money is also mixed, with some considering them good value while others say they're not worth the high price.",Men Men,"Shoes look good, feel good, and already received a compliment. Pretty happy especially for the price"
Reebok Girls Club C Extra,4.8,66.0,https://m.media-amazon.com/images/I/61QNBLIBm9L._AC_SX395_SY395_QL70_ML2_.jpg,Reebok,Customers find these sneakers to be of good quality and cute in style.,Unisex,So cute! And my daughter loves them! So a double win. That rarely happens! She even said her friends at school think they’re cool! Mom win!!!
Reebok Mens,4.2,43.0,https://m.media-amazon.com/images/I/71r+ERiaPnL._AC_SY395_SX395_QL70_FMwebp_.jpg,Reebok,No summary available.,Men,"Got this for runnning and they are really nice, soft and fresh!"
Reebok Mens Cityride,4.7,40.0,https://m.media-amazon.com/images/I/814d20JG8SL._AC_SY395_SX395_QL70_ML2_.jpg,Reebok,"Customers find these sneakers to be of good quality, with one mentioning they're great for gym and sports activities. They are comfortable and have a tight fit.",Men,Really comfortable and lightweight.
Reebok Mens Classic Leather,4.5,39.0,https://m.media-amazon.com/images/I/71FEnjTLuWL._AC_SY395_SX395_QL70_FMwebp_.jpg,Reebok,"Customers find these sneakers comfortable, well-made, and appreciate their classic Reebok style with a simple design. They consider them a great value for money. The fit and size receive mixed feedback - while some find them perfect, others note they run small. Durability is also mixed, with some saying they last forever while others report the shoes falling apart.",Men,These are great walking shoes. Plenty of padding. Leather looks like it will last a long time.
Reebok Mens Classic Nylon,4.7,,https://m.media-amazon.com/images/I/51TUC4lwlgL._AC_SY395_SX395_QL70_FMwebp_.jpg https://m.media-amazon.com/images/I/61MN5HfYfcL._AC_SY395_SX395_QL70_FMwebp_.jpg https://m.media-amazon.com/images/I/71YdOWEn2cL._AC_SX395_SY395_QL70_FMwebp_.jpg,Reebok Reebok Reebok,"Customers find these sneakers to be amazing workout shoes that are comfortable, fit well, and have a great look. They appreciate the classic style and consider them good value for money, with one customer noting they're perfect for walking long distances. The durability receives mixed feedback - while some say they stand the test of time, others report issues with the soles wearing down. Customers find these sneakers to be high-quality, comfortable, and well-fitting, with one noting they're great nursing shoes. They appreciate the timeless style, classic design, and multiple color options. The shoes are durable, with one customer mentioning they hold up well even when wet, and customers consider them good value for money. Customers find these walking shoes to be of good quality, comfortable, and well-fitting. The color receives mixed reactions from customers.",Men Men Men,"Fit good, look good and affordable. Quality shoe as expected from a brand like Reebok. Also arrived on time. Thanks!"
